{
  "schema_version": 1,
  "recipe_id": "home_kitchen",
  "recipe_version": "1.0.0",
  "registry_id": "living_room_shadow",
  "registry_version": "1.3.0",
  "seed": 101,
  "description": "第一套住宅的温馨厨房，包含真实 CC0 冰箱、水槽、烤箱、餐桌与座椅。",
  "room": {
    "name": "厨房",
    "dimensions_m": {"width": 7.0, "depth": 6.0, "height": 3.0},
    "bounds": {"min": [-2.9, 0.0, -2.4], "max": [2.9, 0.0, 2.4]},
    "floor": {"thickness_m": 0.1, "material_key": "warm_kitchen_floor"},
    "walls": [
      {"wall_id": "back", "thickness_m": 0.2, "height_m": 3.0, "material_key": "warm_plaster"},
      {"wall_id": "left", "thickness_m": 0.2, "height_m": 3.0, "material_key": "warm_plaster"},
      {"wall_id": "right", "thickness_m": 0.2, "height_m": 3.0, "material_key": "warm_plaster"}
    ],
    "openings": []
  },
  "object_slots": [
    {
      "semantic_id": "kitchen_fridge", "asset_id": "kitchen_fridge", "display_name": "冰箱",
      "description": "装着日常食材和饮料的冰箱。", "position": [-2.4, 0.95, -2.5],
      "rotation_deg": [0, 0, 0], "interaction_point": [-2.4, 0, -1.65],
      "needs_proximity": true, "affordances": ["open", "take_food", "store_food", "inspect"],
      "effects": {}, "initial_state": "关闭", "properties": {"food_count": 6}, "consumable": false
    },
    {
      "semantic_id": "kitchen_sink", "asset_id": "kitchen_sink_counter", "display_name": "水槽",
      "description": "可以清洗餐具和接水的料理台。", "position": [-0.85, 0.45, -2.55],
      "rotation_deg": [0, 0, 0], "interaction_point": [-0.85, 0, -1.65],
      "needs_proximity": true, "affordances": ["wash", "fill_water", "inspect"],
      "effects": {}, "initial_state": "干净", "properties": {"water_running": false}, "consumable": false
    },
    {
      "semantic_id": "kitchen_oven", "asset_id": "kitchen_oven", "display_name": "烤箱",
      "description": "可以烘烤简单食物的小烤箱。", "position": [0.55, 0.45, -2.52],
      "rotation_deg": [0, 0, 0], "interaction_point": [0.55, 0, -1.65],
      "needs_proximity": true, "affordances": ["turn_on", "turn_off", "cook", "inspect"],
      "effects": {}, "initial_state": "关闭", "properties": {"temperature_c": 24}, "consumable": false
    },
    {
      "semantic_id": "kitchen_table", "asset_id": "kitchen_table", "display_name": "餐桌",
      "description": "适合两个人一起吃饭的木质餐桌。", "position": [0.0, 0.4, 0.35],
      "rotation_deg": [0, 0, 0], "interaction_point": [0.0, 0, 1.35],
      "needs_proximity": true, "affordances": ["place_item", "eat", "inspect"],
      "effects": {}, "initial_state": "收拾整齐", "properties": {}, "consumable": false
    },
    {
      "semantic_id": "kitchen_chair_left", "asset_id": "kitchen_chair", "display_name": "左侧餐椅",
      "position": [-1.25, 0.5, 0.35], "rotation_deg": [0, 90, 0],
      "interaction_point": [-1.25, 0, 1.0], "needs_proximity": true,
      "affordances": ["sit", "inspect"], "effects": {"energy": 4},
      "initial_state": "空着", "properties": {}, "consumable": false
    },
    {
      "semantic_id": "kitchen_chair_right", "asset_id": "kitchen_chair", "display_name": "右侧餐椅",
      "position": [1.25, 0.5, 0.35], "rotation_deg": [0, -90, 0],
      "interaction_point": [1.25, 0, 1.0], "needs_proximity": true,
      "affordances": ["sit", "inspect"], "effects": {"energy": 4},
      "initial_state": "空着", "properties": {}, "consumable": false
    },
    {
      "semantic_id": "kitchen_plant", "asset_id": "plant_potted", "display_name": "厨房香草",
      "position": [2.35, 0.55, 1.75], "rotation_deg": [0, 0, 0],
      "interaction_point": [1.75, 0, 1.75], "needs_proximity": true,
      "affordances": ["water", "prune", "look_at"], "effects": {},
      "initial_state": "状态良好", "properties": {"moisture": 70, "health": 90}, "consumable": false
    },
    {
      "semantic_id": "kitchen_lamp", "asset_id": "standing_lamp", "display_name": "厨房暖灯",
      "position": [-2.35, 0.86, 1.8], "rotation_deg": [0, 0, 0],
      "interaction_point": [-1.8, 0, 1.8], "needs_proximity": true,
      "affordances": ["turn_on", "turn_off", "inspect"], "effects": {},
      "initial_state": "暖光已开启", "properties": {}, "consumable": false
    }
  ],
  "waypoints": {
    "entry_living": [0.0, 0.0, 2.2],
    "room_center": [0.0, 0.0, -0.6],
    "fridge_front": [-2.4, 0.0, -1.55],
    "sink_front": [-0.85, 0.0, -1.55],
    "oven_front": [0.55, 0.0, -1.55],
    "table_left": [-1.25, 0.0, 1.0],
    "table_right": [1.25, 0.0, 1.0]
  },
  "routes": {"room_perimeter": ["entry_living", "table_right", "oven_front", "fridge_front", "table_left"]},
  "immutable_anchors": [],
  "variable_fields": []
}
